{
  "protocol": "SATROOT-1",
  "version": "0.1",
  "action": "genesis",
  "profile": "SATROOT-IDENTITY-1",
  "profile_mode": "single-identity",
  "identity_type": "service-identity",
  "subject_id": "node-alpha",
  "controller_entity": "issuer-co",
  "authority_scope": "api-signing",
  "intended_use": "machine-identity-ledger",
  "root_id": "4444444444444444444444444444444444444444444444444444444444444444:0",
  "sequence": 0,
  "symbol": "IDENTITY1",
  "name": "SATROOT Service Identity",
  "decimals": 0,
  "max_supply": "1",
  "mint_authority": "issuer",
  "transfer_model": "account-ledger",
  "initial_balances": {
    "issuer": "1"
  },
  "rules_hash": "sha256:identity1-demo",
  "nonce": "satroot-identity-v0.1-demo"
}
