[
  {
    "protocol": "SATROOT-1",
    "version": "0.1",
    "action": "genesis",
    "profile": "SATROOT-MACHINE-1",
    "profile_mode": "prepaid-credit",
    "service_scope": "api-compute",
    "billing_unit": "request",
    "consumption_model": "burn-on-use",
    "intended_use": "machine-api-credit",
    "root_id": "2222222222222222222222222222222222222222222222222222222222222222:0",
    "sequence": 0,
    "symbol": "APICREDIT1",
    "name": "SATROOT API Credit",
    "decimals": 0,
    "max_supply": "100000000",
    "mint_authority": "issuer",
    "transfer_model": "account-ledger",
    "initial_balances": {
      "issuer": "100000000"
    },
    "rules_hash": "sha256:apicredit1-demo",
    "nonce": "satroot-machine-v0.1-demo",
    "signature": "demo"
  },
  {
    "protocol": "SATROOT-1",
    "version": "0.1",
    "action": "transfer",
    "root_id": "2222222222222222222222222222222222222222222222222222222222222222:0",
    "sequence": 1,
    "prev_event_id": "sha256:e0eaa0742d92df8cda740a767b6a9b20c3a0b1c7b33f8e45703c0ca71aa55608",
    "from": "issuer",
    "to": "tenant_a",
    "amount": "5000000",
    "signer": "issuer",
    "signature": "demo"
  },
  {
    "protocol": "SATROOT-1",
    "version": "0.1",
    "action": "transfer",
    "root_id": "2222222222222222222222222222222222222222222222222222222222222222:0",
    "sequence": 2,
    "prev_event_id": "sha256:97b4cff78bd98c8f2ac82d36b48d374fb120f0e465a8e64674d07fad6a1c8192",
    "from": "tenant_a",
    "to": "worker_node",
    "amount": "1200000",
    "signer": "tenant_a",
    "signature": "demo"
  },
  {
    "protocol": "SATROOT-1",
    "version": "0.1",
    "action": "burn",
    "root_id": "2222222222222222222222222222222222222222222222222222222222222222:0",
    "sequence": 3,
    "prev_event_id": "sha256:82dbf579ea424d5e35205636a4cc961d7b8734943846a4b8296ba1eaee6e9045",
    "from": "worker_node",
    "amount": "200000",
    "signer": "worker_node",
    "signature": "demo"
  }
]
