{
  "protocol": "SATROOT-1",
  "version": "0.1",
  "action": "genesis",
  "root_id": "0000000000000000000000000000000000000000000000000000000000000000:0",
  "sequence": 0,
  "symbol": "FLOOR1",
  "name": "One Satoshi Floor Token",
  "decimals": 0,
  "max_supply": "1000000000",
  "mint_authority": "issuer",
  "transfer_model": "account-ledger",
  "initial_balances": {
    "issuer": "1000000000"
  },
  "rules_hash": "sha256:demo",
  "nonce": "satroot-v0.1-demo"
}
