[
  {
    "protocol": "SATROOT-1",
    "version": "0.1",
    "action": "genesis",
    "profile": "SATROOT-RECEIPT-1",
    "profile_mode": "single-receipt",
    "document_type": "invoice-receipt",
    "reference_id": "INV-2026-0001",
    "issuer_entity": "issuer-co",
    "counterparty_entity": "buyer-co",
    "settlement_unit": "USD",
    "intended_use": "invoice-receipt-ledger",
    "root_id": "3333333333333333333333333333333333333333333333333333333333333333:0",
    "sequence": 0,
    "symbol": "RECEIPT1",
    "name": "SATROOT Invoice Receipt",
    "decimals": 0,
    "max_supply": "1",
    "mint_authority": "issuer",
    "transfer_model": "account-ledger",
    "initial_balances": {
      "issuer": "1"
    },
    "rules_hash": "sha256:receipt1-demo",
    "nonce": "satroot-receipt-v0.1-demo",
    "signature": "demo"
  },
  {
    "protocol": "SATROOT-1",
    "version": "0.1",
    "action": "transfer",
    "root_id": "3333333333333333333333333333333333333333333333333333333333333333:0",
    "sequence": 1,
    "prev_event_id": "sha256:e70955f9b000b0fb374faa8df834ee2b5af7a9ead6342f9d57f2df605fdb739e",
    "from": "issuer",
    "to": "buyer",
    "amount": "1",
    "signer": "issuer",
    "signature": "demo"
  },
  {
    "protocol": "SATROOT-1",
    "version": "0.1",
    "action": "transfer",
    "root_id": "3333333333333333333333333333333333333333333333333333333333333333:0",
    "sequence": 2,
    "prev_event_id": "sha256:30d020e7da8eb24539f60e2a8ce33fab05fe3b4bf5641e59ed33cfbee6fa86f3",
    "from": "buyer",
    "to": "archive",
    "amount": "1",
    "signer": "buyer",
    "signature": "demo"
  },
  {
    "protocol": "SATROOT-1",
    "version": "0.1",
    "action": "burn",
    "root_id": "3333333333333333333333333333333333333333333333333333333333333333:0",
    "sequence": 3,
    "prev_event_id": "sha256:8ebaf2d0145033be597e604d02d0d39e6f19d64616434a5d26d2221ebe0c0f63",
    "from": "archive",
    "amount": "1",
    "signer": "archive",
    "signature": "demo"
  }
]
