[
  {
    "protocol": "SATROOT-1",
    "version": "0.1",
    "action": "genesis",
    "root_id": "0000000000000000000000000000000000000000000000000000000000000000:0",
    "sequence": 0,
    "symbol": "FLOOR1",
    "name": "One Satoshi Floor Token",
    "decimals": 0,
    "max_supply": "1000000000",
    "mint_authority": "issuer",
    "transfer_model": "account-ledger",
    "initial_balances": {
      "issuer": "1000000000"
    },
    "rules_hash": "sha256:demo",
    "nonce": "satroot-v0.1-demo",
    "signature": "demo"
  },
  {
    "protocol": "SATROOT-1",
    "version": "0.1",
    "action": "transfer",
    "root_id": "0000000000000000000000000000000000000000000000000000000000000000:0",
    "sequence": 1,
    "prev_event_id": "sha256:bec633b7a72b36b4bce629865e16958e74e0378823bb3d820f409703a0f8490e",
    "from": "issuer",
    "to": "alice",
    "amount": "250000000",
    "signer": "issuer",
    "signature": "demo"
  },
  {
    "protocol": "SATROOT-1",
    "version": "0.1",
    "action": "transfer",
    "root_id": "0000000000000000000000000000000000000000000000000000000000000000:0",
    "sequence": 2,
    "prev_event_id": "sha256:6e8e4f31498fac59a0c939596ebb26dc726bcf763588bcb734949c41d008e378",
    "from": "alice",
    "to": "bob",
    "amount": "100000000",
    "signer": "alice",
    "signature": "demo"
  },
  {
    "protocol": "SATROOT-1",
    "version": "0.1",
    "action": "burn",
    "root_id": "0000000000000000000000000000000000000000000000000000000000000000:0",
    "sequence": 3,
    "prev_event_id": "sha256:373381a9ee97fc629a35e1dcc3ed19c8bda9eb69cbdbc79a6cb90f75d404d4c8",
    "from": "bob",
    "amount": "1000000",
    "signer": "bob",
    "signature": "demo"
  }
]
